{
	"bucket_date": "2015-11-25",
	"data_format_version": "0.2.0",
	"id": "a59899ab-cd33-49db-8ca4-7bf5dd2d317d",
	"input": null,
	"options": [],
	"probe_asn": "AS3269",
	"probe_cc": "IT",
	"probe_ip": "127.0.0.1",
	"report_filename": "2015-11-25/20151125T214003Z-IT-AS3269-http_host-FKByhJTXzseUDZOSvQkPiZur0ji6csV5UCiyarEoCCUCiKicGTgXq06fcJVA6XfA-0.1.0-probe.json",
	"report_id": "FKByhJTXzseUDZOSvQkPiZur0ji6csV5UCiyarEoCCUCiKicGTgXq06fcJVA6XfA",
	"software_name": "ooniprobe",
	"software_version": "1.3.2",
	"test_helpers": {
		"backend": "http://216.156.197.144:80"
	},
	"input_hashes": [],
	"probe_city": null,
	"backend_version": "1.1.4",
	"test_keys": {
		"agent": "agent",
		"filtering_prepend_newline_to_method": false,
		"requests": [
			{
				"request": {
					"body": null,
					"headers": {
						"Host": null
					},
					"method": "GET",
					"tor": {
						"exit_ip": false,
						"exit_name": false,
						"is_tor": false
					},
					"url": "http://216.156.197.144:80"
				},
				"response": {
					"body": "{\"headers_dict\": {\"Connection\": [\"close\"], \"Host\": [\"None\"]}, \"request_line\": \"GET / HTTP/1.1\", \"request_headers\": [[\"Connection\", \"close\"], [\"Host\", \"None\"]]}",
					"code": 200,
					"headers": {}
				},
				"response_length": null
			},
			{
				"request": {
					"body": null,
					"headers": {
						"Host": null
					},
					"method": "\nGET",
					"tor": {
						"exit_ip": false,
						"exit_name": false,
						"is_tor": false
					},
					"url": "http://216.156.197.144:80"
				},
				"response": {
					"body": "{\"headers_dict\": {\"Connection\": [\"close\"], \"Host\": [\"None\"]}, \"request_line\": \"\\nGET / HTTP/1.1\", \"request_headers\": [[\"Connection\", \"close\"], [\"Host\", \"None\"]]}",
					"code": 200,
					"headers": {}
				},
				"response_length": null
			}
		],
		"send_host_header": false,
		"socksproxy": null,
		"start_time": 1448484003.0,
		"transparent_http_proxy": false
	},
	"test_name": "http_host",
	"test_runtime": 0.3475949764,
	"test_start_time": "2015-11-25 21:40:03",
	"test_version": "0.2.4"
}
