{
	"bucket_date": "2015-11-23",
	"data_format_version": "0.2.0",
	"id": "e6f6257f-e7c2-48fa-8345-b7ed055ab1d2",
	"input": "198.175.124.185",
	"options": [
		"-f",
		"citizenlab-urls-global.txt",
		"-T",
		"dns-server-jo.txt"
	],
	"probe_asn": "AS8376",
	"probe_cc": "JO",
	"probe_ip": "127.0.0.1",
	"report_filename": "2015-11-23/20151123T161428Z-JO-AS8376-dns_consistency-F1KI1WusW4c1T6OGyQDgHJjaSQ1bfpqV2G39bpmuHiLAJnse8R1F44vdRuTz6nO4-0.1.0-probe.json",
	"report_id": "F1KI1WusW4c1T6OGyQDgHJjaSQ1bfpqV2G39bpmuHiLAJnse8R1F44vdRuTz6nO4",
	"software_name": "ooniprobe",
	"software_version": "1.3.1",
	"test_helpers": {
		"backend": "8.8.8.8:53"
	},
	"input_hashes": [
		"0055f0881fba857d8b48123017d7aec83014e89f057e44b66107f657ec5e2eab"
	],
	"probe_city": null,
	"backend_version": "1.1.4",
	"test_keys": {
		"control_resolver": "8.8.8.8:53",
		"errors": {
			"212.118.0.1": "no_answer",
			"212.118.0.2": "no_answer",
			"212.38.128.3": "dns_lookup_error",
			"217.144.6.6": "no_answer",
			"8.8.8.8:53": "no_answer",
			"80.90.160.135": "dns_lookup_error",
			"80.90.160.172": "dns_lookup_error",
			"81.28.112.2": "dns_lookup_error"
		},
		"failed": [
			"80.90.160.172",
			"8.8.8.8:53",
			"212.118.0.2",
			"80.90.160.135",
			"212.38.128.3",
			"212.118.0.1",
			"217.144.6.6",
			"81.28.112.2"
		],
		"inconsistent": [],
		"queries": [
			{
				"answers": [],
				"failure": "no_answer",
				"hostname": "198.175.124.185",
				"query_type": "A",
				"resolver_hostname": "8.8.8.8",
				"resolver_port": 53
			},
			{
				"answers": [],
				"failure": "deferred_timeout_error",
				"hostname": "198.175.124.185",
				"query_type": "A",
				"resolver_hostname": "212.38.128.3",
				"resolver_port": 53
			},
			{
				"answers": [],
				"failure": "no_answer",
				"hostname": "198.175.124.185",
				"query_type": "A",
				"resolver_hostname": "217.144.6.6",
				"resolver_port": 53
			},
			{
				"answers": [],
				"failure": "deferred_timeout_error",
				"hostname": "198.175.124.185",
				"query_type": "A",
				"resolver_hostname": "81.28.112.2",
				"resolver_port": 53
			},
			{
				"answers": [],
				"failure": "deferred_timeout_error",
				"hostname": "198.175.124.185",
				"query_type": "A",
				"resolver_hostname": "80.90.160.135",
				"resolver_port": 53
			},
			{
				"answers": [],
				"failure": "deferred_timeout_error",
				"hostname": "198.175.124.185",
				"query_type": "A",
				"resolver_hostname": "80.90.160.172",
				"resolver_port": 53
			},
			{
				"answers": [],
				"failure": "no_answer",
				"hostname": "198.175.124.185",
				"query_type": "A",
				"resolver_hostname": "212.118.0.1",
				"resolver_port": 53
			},
			{
				"answers": [],
				"failure": "no_answer",
				"hostname": "198.175.124.185",
				"query_type": "A",
				"resolver_hostname": "212.118.0.2",
				"resolver_port": 53
			}
		],
		"start_time": 1448291668,
		"successful": []
	},
	"test_name": "dns_consistency",
	"test_runtime": 0.0837070942,
	"test_start_time": "2015-11-23 16:14:28",
	"test_version": "0.6"
}
